Titre,Date,Lieu,Hauteur,Largeur,Support,Matiere,Url
Alcools,1/1/1960,"Waccabuc, NY",49,68,toile sur carton,huile,"Alcools.jpg"
Femme assise à la chaise,1/1/1960,South Salem,58,43,toile,huile,"Femme assise à la chaise.jpg"
Les oranges,1/1/1960,,43,59,toile,huile,"Les oranges.jpg"
Nature morte aux livres 48,1/1/1960,"South Salem, NY",61,50,toile,huile,"Nature morte aux livres 48.jpg"
Oignon et verre de vin,1/1/1960,South Salem,42.5,58,toile,huile,"oignon et verre de vin.jpg"
Oranges et bananes,1/1/1960,Paris,54,65,toile,huile,"Oranges et bananes.jpg"
Femme assise à la chaise,1/1/1960,South Salem,58,43,toile,huile,"Portrait d_une femme assise.jpg"
Portrait de sa femme,1/1/1947,Waccabuc N-Y,37.5,31,carton,huile,"portrait de sa femme.jpg"
